{
	"schemaVersion": 1,
	"stage": "stage-0",
	"capturedAt": "2026-07-15T03:10:37.042Z",
	"source": {
		"baseSha": "b981dc707bdf34e10094281958cffd5f9a22f741",
		"preMigrationSha": "3577ee33903eb37a45e1baa8b89917e0d408493e",
		"implementationSha": "e0210de4df563793ebe1a8529cd6016f8cca0306",
		"exactHeadEvidence": "The final PR head SHA and exact-head required check run are recorded in the PR description because a committed file cannot contain its own commit SHA."
	},
	"environment": {
		"commands": [
			["sw_vers"],
			["uname", "-mrs"],
			["sysctl", "-n", "hw.logicalcpu", "hw.memsize"],
			["docker", "version", "--format", "<version-template>"],
			["docker", "info", "--format", "<info-template>"]
		],
		"host": {
			"os": "macOS",
			"osVersion": "26.3.1(a)",
			"kernel": "Darwin 25.3.0",
			"architecture": "arm64",
			"logicalCpu": 12,
			"memoryBytes": 34359738368
		},
		"docker": {
			"clientVersion": "29.4.0",
			"serverVersion": "29.4.0",
			"apiVersion": "1.54",
			"os": "linux",
			"architecture": "arm64",
			"storageDriver": "overlayfs",
			"logicalCpu": 10,
			"memoryBytes": 16820461568
		},
		"tools": [
			{
				"name": "bun",
				"status": "measured",
				"version": "1.3.13",
				"reason": "observed on host"
			},
			{
				"name": "graphify",
				"status": "measured",
				"version": "0.9.16",
				"reason": "observed on host"
			},
			{
				"name": "devpod",
				"status": "measured",
				"version": "0.6.15",
				"reason": "observed on host"
			},
			{
				"name": "devcontainer",
				"status": "measured",
				"version": "0.87.0",
				"reason": "observed on host"
			},
			{
				"name": "gh",
				"status": "measured",
				"version": "2.59.0",
				"reason": "observed on host"
			},
			{
				"name": "caddy",
				"status": "measured",
				"version": "2.11.4",
				"reason": "observed on host"
			},
			{
				"name": "docker",
				"status": "measured",
				"version": "29.4.0",
				"reason": "observed on host"
			},
			{
				"name": "proto",
				"status": "unavailable",
				"version": null,
				"reason": "not installed on the host"
			},
			{
				"name": "moon",
				"status": "unavailable",
				"version": null,
				"reason": "not installed on the host"
			},
			{
				"name": "hyperfine",
				"status": "unavailable",
				"version": null,
				"reason": "not installed on the host"
			}
		]
	},
	"inventory": {
		"commands": [
			[
				"docker",
				"ps",
				"-aq",
				"--filter",
				"label=com.devenv.evidence.run=<run-id>"
			],
			["docker", "images", "--format", "<repository-and-tag-template>"],
			["docker", "system", "df", "-v", "--format", "json"]
		],
		"scopedBefore": {
			"capturedAt": "2026-07-15T02:43:36.000Z",
			"containers": 0,
			"images": 0,
			"volumes": 0
		},
		"ambientLegacy": {
			"status": "measured",
			"protoVolumeCount": 19,
			"totalBytesRounded": 26830600000,
			"attribution": "Separately observed template-style Proto volumes on the shared host; they could not be attributed to this checkout and were never touched by the controlled run."
		},
		"controlledRun": {
			"runLabel": "com.devenv.evidence.run=20260715t030027z",
			"imageId": "sha256:0462403e19cc2defe6d32152a36c4011a0526f312344fc9fbc87e5c76038cad9",
			"imageInspectSizeBytes": 677891195,
			"containerIds": [
				"640056d79f6a4f710ff053c821621564863ab4a6d92216bc40bece7054a23219",
				"a867cffbf2c83ab66489ff4b044e5b8ed018d17d63bb267078bee6e63eaa7e8b"
			],
			"volumeCount": 14,
			"perWorktreeVolumeBytesRounded": 69188600,
			"containerSizeRwBytes": 26877952,
			"containerRootFsBytes": 1961484288
		}
	},
	"locks": {
		"command": ["bun", "<lock-analysis-script>", "bun.lock"],
		"bun": {
			"path": "bun.lock",
			"sha256": "d1dd9a79857d28f80ae71da26101a28882074cbadd07825400ca2741477e4880",
			"packageEntries": 199,
			"uniqueResolvedPairs": 173,
			"multiVersionPackages": [
				"ansi-regex",
				"ansi-styles",
				"emoji-regex",
				"is-fullwidth-code-point",
				"is-unicode-supported",
				"picomatch",
				"resolve-from",
				"slice-ansi",
				"string-width",
				"strip-ansi",
				"wrap-ansi"
			]
		}
	},
	"ci": {
		"commands": [
			["gh", "api", "repos/MrChrisRodriguez/devenv/branches/main/protection"],
			["gh", "api", "repos/MrChrisRodriguez/devenv/rulesets"],
			[
				"gh",
				"run",
				"list",
				"--branch",
				"main",
				"--limit",
				"20",
				"--json",
				"<run-fields>"
			]
		],
		"defaultBranchProtected": false,
		"rulesetCount": 0,
		"requiredContexts": [],
		"latestRun": {
			"databaseId": 29384003588,
			"headSha": "b981dc707bdf34e10094281958cffd5f9a22f741",
			"conclusion": "success",
			"workflowSeconds": 10,
			"jobName": "Lint, Typecheck & Test",
			"jobDatabaseId": 87253381444,
			"jobSeconds": 8
		},
		"lastTwentyMainDurationsSeconds": [
			9, 10, 10, 11, 11, 12, 12, 12, 12, 12, 12, 13, 13, 13, 13, 14, 14, 15, 15,
			17
		]
	},
	"measurements": {
		"cleanImageBuild": {
			"status": "measured",
			"command": [
				"env",
				"-u",
				"secrets",
				"HOME=<isolated-home>",
				"/usr/bin/time",
				"-p",
				"devcontainer",
				"build",
				"--workspace-folder",
				"<worktree-one>",
				"--no-lockfile",
				"--no-cache",
				"--image-name",
				"devenv-stage0-20260715t030027z",
				"--label",
				"com.devenv.evidence.run=20260715t030027z"
			],
			"value": 312.33,
			"unit": "seconds",
			"notes": "Successful legacy image build; output image ID is recorded in inventory.controlledRun."
		},
		"warmImageBuild": {
			"status": "measured",
			"command": [
				"env",
				"-u",
				"secrets",
				"HOME=<isolated-home>",
				"/usr/bin/time",
				"-p",
				"devcontainer",
				"build",
				"--workspace-folder",
				"<worktree-one>",
				"--no-lockfile",
				"--image-name",
				"devenv-stage0-20260715t030027z",
				"--label",
				"com.devenv.evidence.run=20260715t030027z"
			],
			"value": 17.08,
			"unit": "seconds",
			"notes": "Successful cached build with the same image ID as the clean build."
		},
		"freshStartupSlotOne": {
			"status": "unavailable",
			"command": [
				"env",
				"-u",
				"secrets",
				"HOME=<isolated-home>",
				"/usr/bin/time",
				"-p",
				"devcontainer",
				"up",
				"--workspace-folder",
				"<worktree-one>",
				"--no-lockfile",
				"--id-label",
				"com.devenv.evidence.run=20260715t030027z",
				"--id-label",
				"com.devenv.evidence.slot=one"
			],
			"reason": "Fresh startup did not become ready: onCreateCommand exited 11 after Proto reported all 11 selected tool installs failed.",
			"observedFailureSeconds": 31.49,
			"devcontainerExitCode": 1,
			"lifecycleExitCode": 11
		},
		"freshStartupSlotTwo": {
			"status": "unavailable",
			"command": [
				"env",
				"-u",
				"secrets",
				"HOME=<isolated-home>",
				"/usr/bin/time",
				"-p",
				"devcontainer",
				"up",
				"--workspace-folder",
				"<worktree-two>",
				"--no-lockfile",
				"--id-label",
				"com.devenv.evidence.run=20260715t030027z",
				"--id-label",
				"com.devenv.evidence.slot=two"
			],
			"reason": "Second isolated startup reproduced the onCreateCommand exit 11 and never became ready.",
			"observedFailureSeconds": 23.34,
			"devcontainerExitCode": 1,
			"lifecycleExitCode": 11
		},
		"readiness": {
			"status": "unavailable",
			"command": [
				"devcontainer",
				"up",
				"--workspace-folder",
				"<isolated-worktree>"
			],
			"reason": "Neither isolated worktree completed the lifecycle, so there is no successful readiness time."
		},
		"mechanicalContainerRestart": {
			"status": "measured",
			"command": [
				"/usr/bin/time",
				"-p",
				"docker",
				"restart",
				"--time",
				"2",
				"<slot-one-container-id>"
			],
			"value": 0.3,
			"unit": "seconds",
			"notes": "Docker engine restart only; this is not a readiness-bearing template restart."
		},
		"readyRestart": {
			"status": "unavailable",
			"command": [
				"env",
				"-u",
				"secrets",
				"HOME=<isolated-home>",
				"/usr/bin/time",
				"-p",
				"devcontainer",
				"up",
				"--workspace-folder",
				"<worktree-one>",
				"--no-lockfile",
				"--expect-existing-container",
				"--id-label",
				"com.devenv.evidence.run=20260715t030027z",
				"--id-label",
				"com.devenv.evidence.slot=one"
			],
			"reason": "The existing container failed postStartCommand with exit 127 because bun was unavailable; it did not become ready.",
			"observedFailureSeconds": 0.9,
			"devcontainerExitCode": 1,
			"lifecycleExitCode": 127
		},
		"warmCommandLatency": {
			"status": "unavailable",
			"command": [
				"devcontainer",
				"exec",
				"--container-id",
				"<ready-container-id>",
				"true"
			],
			"reason": "No container reached lifecycle readiness, so a valid warm-command baseline could not be measured."
		},
		"failedLifecycleExecLatency": {
			"status": "measured",
			"command": [
				"devcontainer",
				"exec",
				"--container-id",
				"<failed-lifecycle-container-id>",
				"true"
			],
			"value": {
				"warmupCount": 1,
				"sampleCount": 10,
				"samples": [
					557.45, 538.28, 571.283, 553.311, 592.127, 571.202, 590.724, 574.694,
					576.399, 579.544
				],
				"minimum": 538.28,
				"p50": 571.283,
				"p95": 590.724,
				"maximum": 592.127
			},
			"unit": "milliseconds",
			"notes": "Diagnostic only: the container was running but lifecycle-unready. Percentiles use sorted index floor((n-1)*p) without interpolation."
		},
		"secondWorktreeGrowth": {
			"status": "measured",
			"command": [
				"docker",
				"inspect",
				"--size",
				"<slot-one-container-id>",
				"<slot-two-container-id>"
			],
			"value": {
				"newImageBytes": 0,
				"containerRwBytes": 26877952,
				"volumeBytesRounded": 69188600,
				"checkoutGrowthBytes": 45056,
				"totalBytesRounded": 96111608
			},
			"unit": "bytes",
			"notes": "The second worktree shared the same image ID; rounded volume sizes come from docker system df -v."
		}
	},
	"validation": [
		{
			"command": ["bun", "run", "template:validate"],
			"status": "pass",
			"exitCode": 0,
			"summary": "Registry schema and all three fixture definitions validated."
		},
		{